wav_file_path,txt_content
wav_output\23.wav,曾经，神里家因为没能保护好国宝级别的刀工，遭受了不小的冲击。受愚人众阴谋算计，我们折损了诸多臣下，受到许多责罚。父亲甚至因之早衰，神里家在幕府中的地位也一落千丈…好在兄长继任后力挽狂澜。不过，家门虽已复兴，社奉行一系也上下齐心，但大事要事方面，仍靠兄长定夺。
wav_output\14.wav,「若知是梦何须醒，不比真如一相会。」
wav_output\549.wav,雷电将军会在千手百眼神像前，举办第一百颗神之眼的「狩眼仪式」。
wav_output\689.wav,我觉得，当年神里家主没有对我们这些后人说起这件事，或许也是基于同样的想法。
wav_output\718.wav,兄长，对局中分神可不好哦。
wav_output\125.wav,不用担心，我们没事。
wav_output\216.wav,什么样的异国食物适合带出门送人呢…？
wav_output\800.wav,等我和小野寺先生确认了服装尺寸后，也会前往赛场观看你们的对决的。
wav_output\19.wav,「神之眼」，即是胸怀大志之人所获的印绶。如果问我有什么志向的话…这个还是保密吧，只是一个微不足道的梦想罢了。
wav_output\242.wav,谢谢你安慰我，派蒙。
wav_output\509.wav,嗯，许多已经失去或者害怕失去神之眼的人，都在海祇岛的珊瑚宫麾下组成了反抗组织。
wav_output\653.wav,听哥哥说，稻妻和枫丹的文化交流日程已经正式定下来了。
wav_output\80.wav,嗯…我真是太幸福了…
wav_output\803.wav,而且，只要我们见招拆招，总能找到还击的机会。
wav_output\797.wav,而且，母亲生前也一直很向往其他国家的服饰。这一次，我又帮助母亲完成了一个心愿。
wav_output\354.wav,旅行者你看，有抽签的摊位。
wav_output\391.wav,呀，时间差不多了哦。
wav_output\15.wav,午安。茶饭之后，难免略有困倦。是否有兴致下盘棋提神呢？
wav_output\532.wav,「仪式」…？为什么要交给天领奉行那边来办？
